name,bookingNumber,bookingDate,age,gender,race,height,weight,hairColor,eyeColor,city,arrestingAgency,image,charges
TOMI JUMP, 24-308, 7/8/2024 3:09:00 AM, 45, F, W, WOODSON COUNTY SHERIFF'S OFFICE,none,none,undefined,undefined,undefined,/Images/Default/Blankf.jpg,"Charge Code: , Charge Description: BURGLARY; BUILDING IS A DWELLIN, Bond Amount: none; Charge Code: , Charge Description: CRIMINAL TRESPASS; POSTED LOCKED FENCE PROPERT, Bond Amount: none; Charge Code: , Charge Description: THEFT BY DECEPTION; VALUE UNKNOW, Bond Amount: none"
MAJORS KAGE AUSTIN, 24-307, 7/5/2024 12:46:00 PM, 26, M, W, WOODSON COUNTY SHERIFF'S OFFICE,none,none,undefined,undefined,undefined,/Images/Default/Blank.jpg,
TYLER JOSEPH BOONE, 24-306, 7/5/2024 12:21:00 PM, 21, M, W, WOODSON COUNTY SHERIFF'S OFFICE,none,none,undefined,undefined,undefined,/Images/Default/Blank.jpg,
ANDY ARGUDIN, 24-305, 7/2/2024 11:53:00 AM, 24, M, H,none,none,undefined,undefined,undefined,undefined,/Images/Default/Blank.jpg,"Charge Code: , Charge Description: VEH LIABILITY INSURANCE REQ, Bond Amount: $5,000.00; Charge Code: , Charge Description: OPERATE A MV W/O A VALID LICENS, Bond Amount: none"
RYAN WESLEY CULLISON, 24-304, 7/1/2024 10:58:00 PM, 32, M, W,none,none,undefined,undefined,undefined,undefined,/Images/Default/Blank.jpg,"Charge Code: , Charge Description: VIOL OF PROTECTION ORDER; CONDITION OF RELEASE, Bond Amount: $100,000.00"
RYAN WESLEY CULLISON, 24-303, 7/1/2024 9:20:00 PM, 32, M, WHI,none,none,undefined,undefined,undefined,undefined,/Images/Default/Blank.jpg,"Charge Code: , Charge Description: HARASSMENT BY TELEPHON, Bond Amount: none; Charge Code: , Charge Description: CRIMINAL THREAT; UNKNOWN CIRCUMSTANCE, Bond Amount: $80,000.00; Charge Code: , Charge Description: HARASSMENT BY TELEPHON, Bond Amount: none; Charge Code: , Charge Description: STALKING; INTIMATE CONDUCT CAUSE FEA, Bond Amount: none"
JASON GLENN HOY, 24-301, 6/14/2024 10:27:00 PM, 38, M, W,none,none,undefined,undefined,undefined,undefined,/Images/Default/Blank.jpg,
DOUGLAS PAUL-EUGENE BROGAN, 24-300, 6/13/2024 5:11:00 AM, 33, M, W,none,none,undefined,undefined,undefined,undefined,/Images/Default/Blank.jpg,"Charge Code: , Charge Description: DUI; 3RD CONVICTION IN OVER 10 YEAR, Bond Amount: none; Charge Code: , Charge Description: DRIVING WHILE HABITUAL VIOLATO, Bond Amount: none; Charge Code: , Charge Description: TRANSPORTING AN OPEN CONTAINE, Bond Amount: none; Charge Code: , Charge Description: INTIMIDATION OF WITNESS/VICTIM; ORDERLY ADMIN OF JUSTIC, Bond Amount: none; Charge Code: , Charge Description: DUI; 3RD CONVICTION IN OVER 10 YEAR, Bond Amount: none; Charge Code: , Charge Description: INTIMIDATION OF WITNESS/VICTIM; ORDERLY ADMIN OF JUSTIC, Bond Amount: none"